{
  "event_timestamp": "2026-06-29T23:11:11.558190+10:00",
  "source_file": "Browser_GPU_Memory_365d.log",
  "scenario_label": "system_log_audit",
  "source_kind": "terminal_log",
  "collection_notes": null,
  "data_confidence": "low",
  "observed_telemetry": {
    "memory_pressure_state": "Critical",
    "physical_memory_gb": null,
    "app_memory_gb": null,
    "wired_memory_gb": null,
    "compressed_memory_gb": null,
    "cached_files_gb": null,
    "swap_used_gb": 0.00911,
    "cpu_telemetry": null,
    "gpu_telemetry": null,
    "inference_telemetry": null
  },
  "active_processes": [
    "role",
    "vt hash",
    "domain",
    "intransientState",
    "inheritanceManager",
    "identifier",
    "environment",
    "policy",
    "com.apple.Safari.SafeBrowsing.Service",
    "tags",
    "runningboardd",
    "Google Chrome"
  ],
  "uncertainty_flags": [
    "long_term_log",
    "no_whole_system_memory_totals",
    "multi_day_log_no_single_timestamp",
    "jetsam_boosts_observed",
    "oom_polling_observed"
  ]
}